{"$id":"https://randle.invalid/r6/fresh_run_issuance_policy","$schema":"https://json-schema.org/draft/2020-12/schema","additionalProperties":false,"properties":{"authority_id":{"minLength":1,"type":"string"},"interface_version":{"const":"RANDLE-R6-RUN-ISSUER-1"},"issuer_function_fingerprint":{"pattern":"^[0-9a-f]{64}$","type":"string"},"issuer_git_blob":{"pattern":"^[0-9a-f]{40}$","type":"string"},"issuer_path":{"minLength":1,"type":"string"},"issuer_raw_sha256":{"pattern":"^[0-9a-f]{64}$","type":"string"},"issuing_authority":{"minLength":1,"type":"string"},"nonce_policy":{"minLength":1,"type":"string"},"one_time_use_required":{"type":"boolean"},"schema_version":{"const":"6.0.0-DRAFT"},"validity_seconds":{"minimum":0,"type":"integer"}},"required":["authority_id","interface_version","issuer_function_fingerprint","issuer_git_blob","issuer_path","issuer_raw_sha256","issuing_authority","nonce_policy","one_time_use_required","schema_version","validity_seconds"],"title":"fresh_run_issuance_policy","type":"object"}
