{"authority_id":"R6-FRESH-RUN-ISSUANCE-POLICY","interface_version":"RANDLE-R6-RUN-ISSUER-1","issuer_function_fingerprint":"48c8f8de1ae4e66245d084ba8316c56698c170c5b71d06929b6b5cb59e9370fc","issuer_git_blob":"c702aa2d5c3e3bca5066150518a328dc32c00351","issuer_path":"Architecture/Audits/2026-07-21_Current_Production_Baseline_Capture_Boundary_Specification_DRAFT/fresh_run_issuer_R6_DRAFT.py","issuer_raw_sha256":"9a5d271205d6e361a45b3fae0fa155bd9e333e8413c7a3417da7452ea78e4707","issuing_authority":"R6-INDEPENDENT-RUN-ISSUER","nonce_policy":"CRYPTOGRAPHIC_RANDOM_256_BIT","one_time_use_required":true,"schema_version":"6.0.0-DRAFT","validity_seconds":7200}
